<!DOCTYPE Booking [
    <!ELEMENT Booking (BookingEntry+)>
    <!ELEMENT BookingEntry (userID, carID, startTime, endTime, cost, status)>
    <!ATTLIST BookingEntry bookingID CDATA #REQUIRED>

    <!ELEMENT userID (#PCDATA)>
    <!ELEMENT carID (#PCDATA)>
    <!ELEMENT startTime (#PCDATA)>
    <!ELEMENT endTime (#PCDATA)>
    <!ELEMENT cost (#PCDATA)>
    <!ELEMENT status (#PCDATA)>
]>

<Booking>
    <BookingEntry bookingID="001">
        <bookingID>101</bookingID>
        <userID>USER123</userID>
        <carID>001</carID>
        <startTime>2024-11-20T10:00:00</startTime>
        <endTime>2024-11-20T15:00:00</endTime>
        <cost>150.00</cost>
        <status>Confirmed</status>
    </BookingEntry>

    <BookingEntry bookingID="623">
        <bookingID>102</bookingID>
        <userID>USER456</userID>
        <carID>002</carID>
        <startTime>2024-12-01T09:00:00</startTime>
        <endTime>2024-12-01T13:00:00</endTime>
        <cost>200.00</cost>
        <status>Pending</status>
    </BookingEntry>

    <BookingEntry bookingID="003">
        <bookingID>103</bookingID>
        <userID>USER789</userID>
        <carID>003</carID>
        <startTime>2024-12-05T14:30:00</startTime>
        <endTime>2024-12-05T18:30:00</endTime>
        <cost>175.50</cost>
        <status>Cancelled</status>
    </BookingEntry>

    <BookingEntry bookingID="004">
        <bookingID>104</bookingID>
        <userID>USER321</userID>
        <carID>004</carID>
        <startTime>2024-12-30T08:00:00</startTime>
        <endTime>2024-12-20T12:00:00</endTime>
        <cost>120.00</cost>
        <status>Completed</status>
    </BookingEntry>

    <BookingEntry bookingID="005">
        <bookingID>105</bookingID>
        <userID>USER234</userID>
        <carID>005</carID>
        <startTime>2024-12-29T16:00:00</startTime>
        <endTime>2024-12-29T20:00:00</endTime>
        <cost>250.75</cost>
        <status>Confirmed</status>
    </BookingEntry>
</Booking>


